<?xml version="1.0"?>
<bookfile
  xmlns:xsi="http://www.w3.org/2001/XMLSchema-instance"
  xsi:noNamespaceschemaLocation="bookfile.xsd">
  <transaction borrowDate="2001-10-15">
    <Lender phone="607.555.2222">
      <name>Doug Glass</name>
      <street>416 Disk Drive</street>
      <city>Medfield</city>
      <state>MA</state>
    </Lender>
    <Borrower phone="310.555.1111">
      <name>Britta Regensburg</name>
      <street>219 Union Drive</street>
      <city>Medfield</city>
      <state>CA</state>
    </Borrower>
    <note>Lender wants these back in two weeks!</note>
    <books>
      <book bookID="123-4567-890">
        <bookTitle>Earthquakes for Breakfast</bookTitle>
        <pubDate>2001-10-20</pubDate>
        <replacementValue>15.95</replacementValue>
        <maxDaysOut>14</maxDaysOut>
      </book>
      <book bookID="123-4567-891">
        <bookTitle>Avalanches for Lunch</bookTitle>
        <pubDate>2001-10-21</pubDate>
        <replacementValue>19.99</replacementValue>
        <maxDaysOut>14</maxDaysOut>
      </book>
      <book bookID="123-4567-892">
        <bookTitle>Meteor Showers for Dinner</bookTitle>
        <pubDate>2001-10-22</pubDate>
        <replacementValue>11.95</replacementValue>
        <maxDaysOut>14</maxDaysOut>
      </book>
      <book bookID="123-4567-893">
        <bookTitle>Snacking on Volcanoes</bookTitle>
        <pubDate>2001-10-23</pubDate>
        <replacementValue>17.99</replacementValue>
        <maxDaysOut>14</maxDaysOut>
      </book>
    </books>
  </transaction>
  <transaction borrowDate="2002-11-18">
    <Lender phone="619.555.2222">
      <name>Philip Glass</name>
      <street>146 Floppy Drive</street>
      <city>Chicago</city>
      <state>IL</state>
    </Lender>
    <Borrower phone="310.555.1111">
      <name>Britta Regensburg</name>
      <street>219 Union Drive</street>
      <city>Medfield</city>
      <state>CA</state>
    </Borrower>
    <books>
      <book bookID="321-4567-890">
        <bookTitle>Day Tripping in San Francisco</bookTitle>
        <pubDate>1998-11-20</pubDate>
        <replacementValue>25.95</replacementValue>
        <maxDaysOut>28</maxDaysOut>
      </book>
      <book bookID="321-4567-891">
        <bookTitle>3 Ways to better skiing</bookTitle>
        <pubDate>19889-9-2</pubDate>
        <replacementValue>9.99</replacementValue>
        <maxDaysOut>3</maxDaysOut>
      </book>
      <book bookID="321-4567-892">
        <bookTitle>Skylines of Utah</bookTitle>
        <pubDate>1998-4-1</pubDate>
        <replacementValue>31.95</replacementValue>
        <maxDaysOut>14</maxDaysOut>
      </book>
    </books>
  </transaction>
</bookfile>
